"But the staff was so horrible to us.","1","['staff']","['negative']"
"To be completely fair, the only redeeming factor was the food, which was above average, but couldn't make up for all the other deficiencies of Teodora.","1","['food']","['positive']"
"The food is uniformly exceptional, with a very capable kitchen which will proudly whip up whatever you feel like eating, whether it's on the menu or not.","3","['food', 'kitchen', 'menu']","['positive', 'positive', 'neutral']"
"Not only was the food outstanding, but the little perks were great.","2","['food', 'perks']","['positive', 'positive']"
"Our agreed favorite is the orrechiete with sausage and chicken (usually the waiters are kind enough to split the dish in half so you get to sample both meats).","4","['orrechiete with sausage and chicken', 'waiters', 'dish', 'meats']","['positive', 'positive', 'neutral', 'neutral']"
"The Bagels have an outstanding taste with a terrific texture, both chewy yet not gummy.","1","['Bagels']","['positive']"
"Nevertheless the food itself is pretty good.","1","['food']","['positive']"
"They did not have mayonnaise, forgot our toast, left out ingredients (ie cheese in an omelet), below hot temperatures and the bacon was so over cooked it crumbled on the plate when you touched it.","7","['mayonnaise', 'toast', 'ingredients', 'cheese', 'omelet', 'bacon', 'plate']","['negative', 'negative', 'negative', 'neutral', 'neutral', 'negative', 'neutral']"
"It took half an hour to get our check, which was perfect since we could sit, have drinks and talk!","2","['check', 'drinks']","['neutral', 'neutral']"
"The design and atmosphere is just as good.","2","['design', 'atmosphere']","['positive', 'positive']"
"He has visited Thailand and is quite expert on the cuisine.","1","['cuisine']","['positive']"
"The pizza is the best if you like thin crusted pizza.","2","['pizza', 'thin crusted pizza']","['positive', 'neutral']"
"All the money went into the interior decoration, none of it went to the chefs.","2","['interior decoration', 'chefs']","['positive', 'negative']"
"The seats are uncomfortable if you are sitting against the wall on wooden benches.","1","['seats']","['negative']"
"I asked for seltzer with lime, no ice.","1","['seltzer with lime']","['neutral']"
"Don't go alone---even two people isn't enough for the whole experience, with pickles and a selection of meats and seafoods.","2","['pickles', 'selection of meats and seafoods']","['positive', 'positive']"
"My suggestion is to eat family style because you'll want to try the other dishes.","2","['eat family style', 'dishes']","['positive', 'neutral']"
"Best of all is the warm vibe, the owner is super friendly and service is fast.","3","['vibe', 'owner', 'service']","['positive', 'positive', 'positive']"
"Faan's got a great concept but a little rough on the delivery.","1","['delivery']","['negative']"
"From the incredible food, to the warm atmosphere, to the friendly service, this downtown neighborhood spot doesn't miss a beat.","3","['food', 'atmosphere', 'service']","['positive', 'positive', 'positive']"
"Great food at REASONABLE prices, makes for an evening that can't be beat!","2","['food', 'prices']","['positive', 'positive']"
"this little place has a cute interior decor and affordable city prices.","2","['interior decor', 'prices']","['positive', 'positive']"
"Two words: Free wine.","1","['wine']","['positive']"
"The price is reasonable although the service is poor.","2","['price', 'service']","['positive', 'negative']"
"The quantity is also very good, you will come out satisfied.","1","['quantity']","['positive']"
"I stumbled upon this second floor walk-up two Fridays ago when I was with two friends in town from L.A. Being serious sushi lovers, we sat at the sushi bar to be closer to the action.","2","['sushi', 'sushi bar']","['neutral', 'neutral']"
"The fried rice is amazing here.","1","['fried rice']","['positive']"
"Three courses - choices include excellent mussels, puff pastry goat cheese and salad with a delicious dressing, and a hanger steak au poivre that is out of this world.","5","['courses', 'mussels', 'puff pastry goat cheese', 'salad with a delicious dressing', 'hanger steak au poivre']","['neutral', 'positive', 'positive', 'positive', 'positive']"
"it's a perfect place to have a amanzing indian food.","1","['indian food']","['positive']"
"The place is so cool and the service is prompt and curtious.","2","['place', 'service']","['positive', 'positive']"
"At the end you're left with a mild broth with noodles that you can slurp out of a cup.","1","['broth with noodles']","['positive']"
"I just wonder how you can have such a delicious meal for such little money.","2","['meal', 'money']","['positive', 'positive']"
"The wine list is excellent.","1","['wine list']","['positive']"
"Ive been to many Thai restaurants in Manhattan before, and Toons is by far the best Thai food Ive had (except for my mom's of course).","1","['Thai food']","['positive']"
"They wouldnt even let me finish my glass of wine before offering another.","1","['glass of wine']","['neutral']"
"Whem asked, we had to ask more detailed questions so that we knew what the specials were.","1","['specials']","['neutral']"
"This is a consistently great place to dine for lunch or dinner.","3","['dine', 'lunch', 'dinner']","['positive', 'neutral', 'neutral']"
"Nice atmosphere, the service was very pleasant and the desert was good.","3","['atmosphere', 'service', 'desert']","['positive', 'positive', 'positive']"
"After really enjoying ourselves at the bar we sat down at a table and had dinner.","3","['bar', 'table', 'dinner']","['positive', 'neutral', 'neutral']"
"Fabulous service, fantastic food, and a chilled out atmosphere and environment.","4","['service', 'food', 'atmosphere', 'environment']","['positive', 'positive', 'positive', 'positive']"
"Try the lasagnette appetizer.","1","['lasagnette appetizer']","['positive']"
"I liked the beer selection!","1","['beer selection']","['positive']"
"Great food, good size menu, great service and an unpretensious setting.","4","['food', 'menu', 'service', 'setting']","['positive', 'positive', 'positive', 'positive']"
"Go here for a romantic dinner but not for an all out wow dining experience.","2","['dinner', 'dining']","['positive', 'positive']"
"I grew up eating Dosa and have yet to find a place in NY to satisfy my taste buds.","1","['Dosa']","['neutral']"
"Wine list selection is good and wine-by-the-glass was generously filled to the top.","2","['Wine list selection', 'wine-by-the-glass']","['positive', 'positive']"
"With the great variety on the menu , I eat here often and never get bored .","1","['menu']","['positive']"
"The menu is very limited - i think we counted 4 or 5 entrees.","2","['menu', 'entrees']","['negative', 'negative']"
"The menu is limited but almost all of the dishes are excellent.","2","['menu', 'dishes']","['negative', 'positive']"
"Not too crazy about their sake martini.","1","['sake martini']","['negative']"
"Great bagels, spreads and a good place to hang out in.","2","['bagels', 'spreads']","['positive', 'positive']"
"One thing I liked about this place is that I never felt rushed or pressured to give up my table ot incoming guests.","1","['table']","['neutral']"
"Unfortunately, the food is outstanding, but everything else about this restaurant is the pits.","1","['food']","['positive']"
"We always have a delicious meal and always leave feeling satisfied.","1","['meal']","['positive']"
"Dip the ingredients in with your chopsticks, swirl them around, and eat.","2","['ingredients', 'chopsticks']","['neutral', 'neutral']"
"First went here to enjoy their garden terrace.","1","['garden terrace']","['positive']"
"The pizza was pretty good and huge.","1","['pizza']","['positive']"
"The cuisine from what I've gathered is authentic Taiwanese, though its very different from what I've been accustomed to in Taipei.","1","['cuisine']","['neutral']"
"I almost hesititate to write a review because the atmosphere was so great and I would hate for it too become to crowded.","1","['atmosphere']","['positive']"
"They are often crowded on the weekends but they are efficient and accurate with their service.","2","['crowded', 'service']","['negative', 'positive']"
"All my co-workers were amazed at how small the dish was.","1","['dish']","['negative']"
"The atmosphere is unheralded, the service impecible, and the food magnificant.","3","['atmosphere', 'service', 'food']","['positive', 'positive', 'positive']"
"We ordered the special, grilled branzino, that was so infused with bone, it was difficult to eat.","1","['grilled branzino']","['negative']"
"The wait staff is friendly, and the food has gotten better and better!","2","['wait staff', 'food']","['positive', 'positive']"
"It may be a bit packed on weekends, but the vibe is good and it is the best French food you will find in the area.","3","['packed', 'vibe', 'French food']","['negative', 'positive', 'positive']"
"Right off the L in Brooklyn this is a nice cozy place with good pizza.","2","['place', 'pizza']","['positive', 'positive']"
"Le Pere Pinard has a $15 pre-theater menu that is outstanding.","1","['pre-theater menu']","['positive']"
"I also ordered for delivery and the restaurant forgot half the order.","2","['delivery', 'order']","['negative', 'negative']"
"Our server checked on us maybe twice during the entire meal.","2","['server', 'meal']","['negative', 'neutral']"
"The strong scents coming from the left and right of me negatively affected my taste buds.","1","['scents']","['negative']"
"We had the lobster sandwich and it was FANTASTIC.","1","['lobster sandwich']","['positive']"
"Had we been stalling I could understand where they were coming from, but we had been there less than an hour and they hadn't even brought us a check yet!","1","['check']","['negative']"
"Though the Spider Roll may look like a challenge to eat, with soft shell crab hanging out of the roll, it is well worth the price you pay for them.","2","['shell crab', 'price']","['positive', 'positive']"
"Deep Fried Skewers are good and still rare to find in NYC.","1","['Deep Fried Skewers']","['positive']"
"I have tried to make reservations, but both times, the hostess didn't have my name.","2","['reservations', 'hostess']","['neutral', 'negative']"
"I also recommend the rice dishes or the different varieties of congee (rice porridge).","2","['rice dishes', 'congee (rice porridge)']","['positive', 'positive']"
"Their tuna tartar appetizer is to die for.","1","['tuna tartar appetizer']","['positive']"
"An oasis of refinement:  Food, though somewhat uneven, often reaches the pinnacles of new American fine cuisine - chef's passion (and kitchen's precise execution) is most evident in the fish dishes and soups.","5","['cuisine', 'chef', 'kitchen', 'fish dishes', 'soups']","['positive', 'positive', 'positive', 'positive', 'positive']"
"If you love wine and cheese and delicious french fare, you'll love Artisanal!","3","['wine', 'cheese', 'french fare']","['positive', 'positive', 'positive']"
"I love Indian food and consider myself to be quite an expert on it.","1","['Indian food']","['positive']"
"Some baby pizzas get their wish.","1","['baby pizzas']","['neutral']"
"Overall A oh ya even though there is waiting it is deff worth it","1","['waiting']","['negative']"
"The lava cake dessert was incredible and I recommend it.","1","['lava cake dessert']","['positive']"
"VT is what baby pizzas hope to be when they grow up.","1","['baby pizzas']","['neutral']"
"From the terrible service, to the bland food, not to mention the unaccommodating managers, the overall experience was horrible.","3","['service', 'food', 'managers']","['negative', 'negative', 'negative']"
"Lahore is a great place to duck into late-night when you need some really tasty food on the cheap -- you'll likely have trouble finishing the amount of food you get for FOUR DOLLARS.","2","['food', 'food']","['positive', 'positive']"
"The last time I went we were seated at a table in a corridor next to the kitchen.","1","['table']","['negative']"
"good selection of wines ranging from affordable to high end.","1","['selection of wines']","['positive']"
"Nice restaurant overall, with classic upscale Italian decor.","1","['Italian decor']","['positive']"
"Not impressed with the food.","1","['food']","['negative']"
"The entire dining experience was wonderful!","1","['dining experience']","['positive']"
"The wine selection (by the glass and bottle) is wonderful and I always recommend that friends make a reservation if they're going to be in town.","2","['wine selection', 'reservation']","['positive', 'neutral']"
"Service is highly refined: our seating was delayed 35 minutes past our reservation and the maitre d' apologized and regularly kept us apprised of progress.","3","['Service', 'reservation', 'maitre']","['positive', 'negative', 'positive']"
"Order the panang duck, it's fantastic.","1","['panang duck']","['positive']"
"Food is usually very good, though ocasionally I wondered about freshmess of raw vegatables in side orders.","1","['raw vegatables']","['negative']"
"Other than the crappy service from two individuals, it's great.","1","['service']","['negative']"
"They have authentic Indian at amazin prices.","2","['Indian', 'prices']","['positive', 'positive']"
"Ambiance- relaxed and stylish.","1","['Ambiance']","['positive']"
"Luckily we saved room for the BBQ Salmon, Sea Bass and Crispy Duck.","3","['BBQ Salmon', 'Sea Bass', 'Crispy Duck']","['positive', 'positive', 'positive']"
"Yes, they use fancy ingredients, but even fancy ingredients don't make for good pizza unless someone knows how to get the crust right.","4","['ingredients', 'ingredients', 'pizza', 'crust']","['positive', 'positive', 'negative', 'neutral']"
"and yes Dal Bukhara is so dam good and so are all the kababs.","2","['Dal Bukhara', 'kababs']","['positive', 'positive']"
"I look forward to eating here again","1","['eating']","['positive']"
"I've been coming here as a child and always come back for the taste.","1","['taste']","['positive']"
"Tuk Tuk is one of those comfortable neighborhood joints where you know you will always have a good meal at a fair price.","2","['meal', 'price']","['positive', 'positive']"
"A glass of Leaping Lizard, a glass of prosecco, and the mussels had everything happy.","3","['glass of Leaping Lizard', 'glass of prosecco', 'mussels']","['positive', 'positive', 'positive']"
"Food was average and creme brulee was awful - the sugar was charred, not caramelized and smelled of kerosene.","3","['Food', 'creme brulee', 'sugar']","['neutral', 'negative', 'negative']"
"The food always tastes fresh and served promptly.","2","['food', 'served']","['positive', 'positive']"
"The pizza here is delicious.","1","['pizza']","['positive']"
"Pizza and garlic knots are great as well, I order from them quite often and the delivery is always super quick!","3","['Pizza', 'garlic knots', 'delivery']","['positive', 'positive', 'positive']"
"For great chinese food nearby, you have Wu Liang Ye and Grand Sichuan just a block away.","1","['chinese food']","['positive']"
"But who says Murray's is anything about service.","1","['service']","['neutral']"
"This place is really trendi but they have forgotten about the most important part of a  restaurant, the food.","1","['food']","['negative']"
"Hats off to the chef.","1","['chef']","['positive']"
"Service could be improved but overall this is a place that understands the importance of little things (the heavy, black, antique-seeming teapot, for one) in the restaurant experience.","2","['Service', 'teapot']","['negative', 'positive']"
"The pizza is delicious - they use fresh mozzarella instead of the cheap, frozen, shredded cheese common to most pizzaria's.","3","['pizza', 'fresh mozzarella', 'cheese']","['positive', 'positive', 'negative']"
"Its an excellent place to relax and the food is one of the best in the city of New York.","2","['place', 'food']","['positive', 'positive']"
"service is friendly, and never had a problem walking in and getting a table.","2","['service', 'getting a table']","['positive', 'positive']"
"The atmosphere was crowded but it was a great bistro-type vibe.","1","['bistro-type vibe']","['positive']"
"First off, the waitress was completely unattentive the 2 times we saw her(odd in a restaurant with 6 tables) and got our order wrong.","2","['waitress', 'tables']","['negative', 'neutral']"
"The food was bland oily.","1","['food']","['negative']"
"What is even better, is that the prices are very affordable as well, and the food is really good.","2","['prices', 'food']","['positive', 'positive']"
"The fish is fresh but the variety of fish is nothing out of ordinary.","2","['fish', 'variety of fish']","['positive', 'negative']"
"Our favorite meal is a pesto pizza, the house salad, and a good bottle of wine.","4","['meal', 'pesto pizza', 'house salad', 'bottle of wine']","['positive', 'positive', 'positive', 'positive']"
"And Kruno, the beverage manager is the best bartender I have yet to come across.","2","['beverage manager', 'bartender']","['positive', 'positive']"
"Ambiance and music funky, which I enjoy.","2","['Ambiance', 'music']","['positive', 'positive']"
"The food, drinks and service are clearly among the best in the city.","3","['food', 'drinks', 'service']","['positive', 'positive', 'positive']"
"I went there in late afternoon for some bite size food and refleshment with my date.","2","['food', 'refleshment']","['neutral', 'neutral']"
"I understand the area and folks you need not come here for the romantic, alluring ambiance or the five star service featuring a sommlier and a complicated maze of captain and back waiters - you come for the authentic foods, the tastes, the experiance.","7","['ambiance', 'service', 'sommlier', 'captain', 'back waiters', 'foods', 'tastes']","['positive', 'positive', 'positive', 'positive', 'positive', 'positive', 'positive']"
"Last time I went here, the waitress didn't come back after taking our order.","1","['waitress']","['negative']"
"Try the tandoori salmon!","1","['tandoori salmon']","['positive']"
"Eating in, the atmosphere saves it, but at your desk, it's a very disappointing experience.","1","['atmosphere']","['positive']"
"Granted the space is smaller than most, it is the best service you will find in even the largest of restaurants.","2","['space', 'service']","['negative', 'positive']"
"I love the atmorphere @ peep!","1","['atmorphere']","['positive']"
"The service was attentive and her suggestions of menu items was right on the mark.","2","['service', 'menu items']","['positive', 'positive']"
"The other night we had the $30 three course meal and everything was delicious - if I could of licked the plate clean I would of.","1","['three course meal']","['positive']"
"Even after getting pushed out by the no-class Famous Ray's, Sal has risen again to carry on his father's uncle's legacies with a smile, true love for his community, and let's not forget the Outstanding Pizza!","1","['Pizza']","['positive']"
"The environment is romantic, but the food is horrible, the service is pathetic, and gabriella lies about everything she could.","3","['environment', 'food', 'service']","['positive', 'negative', 'negative']"
"We had crawfish boiled and despite making a mess, it was a ton of fun and quite tasty as well.","1","['crawfish boiled']","['positive']"
"I had very high expectations for this place and made a reservation a couple of months in advance for a special occasion.","1","['reservation']","['neutral']"
"What came to our table was burned beyond recognition and stringy.","1","['table']","['neutral']"
"I had the Pad Thai and the noodles were sticky.","2","['Pad Thai', 'noodles']","['negative', 'negative']"
"So I've never actually been to M proper, but I've had it delivered a few times.","1","['delivered']","['neutral']"
"Among all of the new 5th avenue restaurants, this offers by far one of the best values for your money.","1","['values for your money']","['positive']"
"Frankly, when you compare what you can have here for lunch, versus McDs or so many other sandwich shops in the city, there is no comparison.","1","['lunch']","['positive']"
"The hostess is rude to the point of being offensive.","1","['hostess']","['negative']"
"If you're craving for Haru's great food, especially the House Roll, but can't stand the wait building outisde, head across the street to their Sake Bar!","2","['food', 'wait building']","['positive', 'negative']"
"A narrow corridor leads to a tiny space where there are three tiny white tiled counters, a great deal of mess (stacks of bottles, cans) and a small counter holding 12-14 entrees.","5","['corridor', 'space', 'counters', 'counter', 'entrees']","['negative', 'negative', 'negative', 'negative', 'neutral']"
"The food is great.","1","['food']","['positive']"
"Succulent steaks cooked precisely to your desired 'doneness' accompanied by salads and sides that don't look like leafy road kill.","3","['steaks', 'salads', 'sides']","['positive', 'positive', 'positive']"
"Lunch came with pickels and slaw, no extra charge.","2","['Lunch', 'pickels and slaw']","['positive', 'neutral']"
"Decent wine at reasonable prices.","2","['wine', 'prices']","['positive', 'positive']"
"All conveniently delivered right to the door.","1","['delivered']","['positive']"
"even the wine by the glass was good.","1","['wine by the glass']","['positive']"
"would have rather tried terrace in the sky or water club for that price","1","['price']","['negative']"
"This dish is my favorite and I always get it when I go there and never get tired of it.","1","['dish']","['positive']"
"I also ordered the Change Mojito, which was out of this world.","1","['Change Mojito']","['positive']"
"Okay service.","1","['service']","['neutral']"
"The only thing more wonderful than the food (which is exceptional) is the service.","2","['food', 'service']","['positive', 'positive']"
"The food was just awful, ATROCIOUS actually.","1","['food']","['negative']"
"The soup for the udon was soy sauce and water.","3","['soup for the udon', 'soy sauce', 'water']","['negative', 'neutral', 'neutral']"
"The anti-pasta was excellent, especially the calamari, as were the filling pasta mains.","3","['anti-pasta', 'calamari', 'filling pasta mains']","['positive', 'positive', 'positive']"
"The waitress suggested glasses of wine that went very well with the food.","3","['waitress', 'glasses of wine', 'food']","['positive', 'positive', 'neutral']"
"They might be all business at the counter when you give your order, but their food says I love you.","2","['counter', 'food']","['negative', 'positive']"
"We are very particular about sushi and were both please with every choice which included: ceviche mix (special), crab dumplings, assorted sashimi, sushi and rolls, two types of sake, and the banana tempura.","8","['sushi', 'ceviche mix (special)', 'crab dumplings', 'assorted sashimi', 'sushi', 'rolls', 'sake', 'banana tempura']","['positive', 'positive', 'positive', 'positive', 'positive', 'positive', 'positive', 'positive']"
"Try their plain pizza with fresh garlic or eggplant.","3","['plain pizza', 'garlic', 'eggplant']","['positive', 'positive', 'positive']"
"Ok, so the servers wander around a little clueless, but there's more than enough servers for the crowd they get -- it's fine, you just have to make a small effort to get their attention.","1","['servers']","['negative']"
"Good luck getting a table.","1","['getting a table']","['negative']"
"The service is awful.","1","['service']","['negative']"
"The takeout menu says to keep an eye out for an expanded menu offering more italian dishes, I can't wait!","3","['takeout menu', 'menu', 'italian dishes']","['positive', 'positive', 'positive']"
"I am not the most experienced person when it comes to Thai food, but my friend who took me there is.","1","['Thai food']","['neutral']"
"Regardless of whether there are two people or two hundred people ahead of you the hostess will take your name and tell you Five minutes.","1","['hostess']","['positive']"
"The pizza is good though.","1","['pizza']","['positive']"
"bottles of wine are cheap and good.","1","['bottles of wine']","['positive']"
"The have over 100 different beers to offer thier guest so that made my husband very happy and the food was delicious, if I must recommend a dish it must be the pumkin tortelini.","4","['beers', 'food', 'dish', 'pumkin tortelini']","['positive', 'positive', 'positive', 'positive']"
"They didn't give us the dinner special until we asked for it.","1","['dinner special']","['negative']"
"You must have the crabmeat lasagna which is out of this world and the chocolate bread pudding for dessert.","3","['crabmeat lasagna', 'chocolate bread pudding', 'dessert']","['positive', 'positive', 'positive']"
"word of advice, save room for pasta dishes and never leave until you've had the tiramisu.","2","['pasta dishes', 'tiramisu']","['positive', 'positive']"
"Very good service and very good prices.","2","['service', 'prices']","['positive', 'positive']"
"I recently went to this restaurant with some co-workers for lunch and had an amazing time.","1","['lunch']","['neutral']"
"The service was impeccable and unobtrusive -- the staff knows what they are there to do -- to know their menu, present your meal, and attend to your needs.","4","['service', 'staff', 'menu', 'meal']","['positive', 'positive', 'neutral', 'neutral']"
"Ess-A-Bagel (either by Sty-town or midtown) is by far the best bagel in NY.","1","['bagel']","['positive']"
"Our food was great too!","1","['food']","['positive']"
"The most annoying thing, though, is the fact that the servers seem to be trained to drive revenue.","1","['servers']","['negative']"
