"Our son loves pizza and we have a certified Neapolitan pizzaria in our home city (Seattle), we liked this nearly as much - and the differences were more about personal preference than any reflection on either restaurant.","1","['pizza']","['positive']"
"big and soft as well as good lunch food.","1","['lunch food']","['positive']"
"No food snobs allowed, this place is for people who appreciate good food.","2","['food', 'food']","['neutral', 'positive']"
"I liked the food at this quasi-thai restaurant.","2","['food', 'quasi-thai']","['positive', 'positive']"
"By far the best salad I have had in a fast food restaurant.","2","['salad', 'fast food']","['positive', 'neutral']"
"As for the bar, this is another bad idea.","1","['bar']","['negative']"
"Their bagels are fine, but they are a little overcooked, and not really a 'special' bagel experience.","1","['bagel']","['neutral']"
"Unlike HH up the block, this place actually gives you hearty and hot bagels this town is known for.","1","['bagels']","['positive']"
"The barebecued salmon is elegantly spiced and not at all dry.","1","['barebecued salmon']","['positive']"
"Same owner as the guy who owns Typhoon, which is just down the street on St. Marks and 1st Ave.","1","['owner']","['neutral']"
"What generous portions!","1","['portions']","['positive']"
"The workers there also absolutely load the bagel with cream cheese (gets a little messy).","3","['workers', 'bagel', 'cream cheese']","['neutral', 'neutral', 'neutral']"
"The wine the service was very good too.","2","['wine', 'service']","['positive', 'positive']"
"So, the menu is written in chalk above your head and it all sounds delicious.","1","['menu']","['neutral']"
"The highly spiced chai tea was great too.","1","['chai tea']","['positive']"
"I have been there many times, and food is good and consistent.","1","['food']","['positive']"
"Seriously, this is the best all you can eat in town- As everyone says, the Spicy Tuna hand rolls are the best- have 4 of these, and you've broken even.","1","['Spicy Tuna hand rolls']","['positive']"
"While Sapphire is certainly not lacking in ambiance, and probably has the best decor of any Indian restaurant I have been to in New York City, the food was not what I had hoped for.","3","['ambiance', 'decor', 'food']","['positive', 'positive', 'negative']"
"I would highly recommend this place to anyone looking for a casual atmosphere that whisks you away to the left bank of the river Seine.","1","['atmosphere']","['positive']"
"The meat dishes were only so-so.","1","['meat dishes']","['neutral']"
"His wife Tanya, the hostess, completes the comforting atmosphere by being delightfully warm and gracious.","2","['hostess', 'atmosphere']","['positive', 'positive']"
"The menu consisted of standard brassiere food, better then places like Balthazar etc.","2","['menu', 'brassiere food']","['positive', 'positive']"
"I have been a longtime fan of Holy Basil in the East Village, and while I do believe their food has slightly slipped in quality, I have been hesitant to be disloyal.","2","['food', 'quality']","['negative', 'negative']"
"But the best part about LS is the late night atmosphere, delightfully free of the BTs.","1","['atmosphere']","['positive']"
"We even had a visit from the Manager who wanted to make sure we were enjoying ourselves.","1","['Manager']","['positive']"
"The staff there is very attentive and down to earth.","1","['staff']","['positive']"
"You don't go to Mizu for excellent service, you go for the large amounts of food, the amiable atmosphere, and the hole-in-the-wall feeling of the place.","3","['service', 'food', 'atmosphere']","['negative', 'positive', 'positive']"
"The service is always bad though, don't expect much of anything from your server, and I would not recommend bringing a date here either.","2","['service', 'server']","['negative', 'negative']"
"Monday nights are a bargain at the $28 prix fix - this includes a three course meal plus *three* glasses of wine paired with each course.","4","['prix fix', 'three course meal', 'glasses of wine', 'course']","['positive', 'positive', 'positive', 'neutral']"
"It took them 15 minutes to put water in our glasses.","1","['water']","['neutral']"
"The service is descent even when this small place is packed.","2","['service', 'place']","['positive', 'negative']"
"This is the best sushi in new york city - hands down.","1","['sushi']","['positive']"
"I have eaten a lot of pizza here.","1","['pizza']","['neutral']"
"Great value for the quality ingredients.","1","['ingredients']","['positive']"
"The Thali was small, thoroughly unremarkable, and $14.95.","1","['Thali']","['negative']"
"The sushi is also great!","1","['sushi']","['positive']"
"From the complimentary chef app of a delicate butternut squash ravioli in a delicious truffle sauce to an amazing buttery and tender langostine entree to a dessert that I can't remember because of the fabulous Cakebread Cabernet we were drinking -- the whole evening was amazing.","5","['chef app', 'delicate butternut squash ravioli in a delicious truffle sauce', 'buttery and tender langostine entree', 'dessert', 'Cakebread Cabernet']","['positive', 'positive', 'positive', 'neutral', 'positive']"
"Truly the mark of an attentive waiter.","1","['waiter']","['positive']"
"The food here is rather good, but only if you like to wait for it.","1","['food']","['positive']"
"I got an excellent piece of cheesecake and we had several other nice pastries.","2","['cheesecake', 'pastries']","['positive', 'positive']"
"The staff is very kind and well trained, they're fast, they are always prompt to jump behind the bar and fix drinks, they know details of every item in the menu and make excelent recomendations.","4","['staff', 'bar', 'drinks', 'menu']","['positive', 'neutral', 'neutral', 'neutral']"
"The makhani was OK --the korma was bland.","2","['makhani', 'korma']","['neutral', 'negative']"
"The food is inventive but still keeps traditional indian flavoring.","1","['food']","['positive']"
"The decor in this place is very diner-ish and the kind of place you expect in the East Village - not romantic, just simple, small and sparse.","2","['decor', 'place']","['positive', 'positive']"
"This is a cute place and could be good but they need to get their act together.","1","['place']","['positive']"
"The lox is always fresh too.","1","['lox']","['positive']"
"Service was very friendly.","1","['Service']","['positive']"
"So all I'm trying to say is this restaurant is by far the best thai food restaurant I've ever been to.","1","['thai food']","['positive']"
"Food was OK - fish was cooked well.","2","['Food', 'fish']","['neutral', 'positive']"
"We actually left hungry and went across the street to Wo Hop at 15 Mott street for some good chinese food.","1","['chinese food']","['positive']"
"The duck confit is always amazing and the foie gras terrine with figs was out of this world.","2","['duck confit', 'foie gras terrine with figs']","['positive', 'positive']"
"The whole set up is truly unprofessional and I wish Cafe Noir would get some good staff, because despite the current one this is a great place.","1","['staff']","['negative']"
"The staff offers impeccable service.","2","['staff', 'service']","['positive', 'positive']"
"We ended our great experience by having Gulab Jamun (dessert) recommended by the waiter.","2","['Gulab Jamun (dessert)', 'waiter']","['positive', 'positive']"
"This place doesn't compare with Mamoun's in terms of price, freshness, value, and consisent quality, but that's just my opinion.","4","['price', 'freshness', 'value', 'quality']","['negative', 'negative', 'negative', 'negative']"
"The place is sleek, modern and playfull and i will return again frequently.","1","['place']","['positive']"
"I have known about this secret for the last 13 years, Emilio(the Godfather) has continued to serve food and wine for the gods at mortal prices.","3","['food', 'wine', 'prices']","['positive', 'positive', 'positive']"
"The brioche and lollies as party favors is a cute and sweet touch to a most memorable meal.","2","['brioche and lollies', 'meal']","['positive', 'positive']"
"After being told that our party of three would be seated in 10 minutes and watching other parties (multiples of 2 and higher) seated for 40 minutes, the three of us were squished into a small 2-person table.","1","['2-person table']","['negative']"
"And the bill was outragous.","1","['bill']","['negative']"
"The service was attentive, yet unimposing, the food was far better than many notorious restaurants in Midtown and the wine list is extensive and well priced.","3","['food', 'wine list', 'priced']","['positive', 'positive', 'positive']"
"Kind, attentive wait staff.","1","['wait staff']","['positive']"
"Salads were fantastic.","1","['Salads']","['positive']"
"The owners and employees are friendly and their pizza is fantastic.","3","['owners', 'employees', 'pizza']","['positive', 'positive', 'positive']"
"The food is yummy, especially their cooked-to-perfection mussels in spicy tomato sauce and their shoestring crispy fries.","3","['food', 'mussels in spicy tomato sauce', 'fries']","['positive', 'positive', 'positive']"
"The food is authentic Italian - delicious!","1","['food']","['positive']"
"skip dessert.","1","['dessert']","['negative']"
"I complete the total bagel experience by having it lightly toasted.","1","['bagel']","['positive']"
"It was like the servers forgot that they actually worked there and instead wanted to hang out and be cool.","1","['servers']","['negative']"
"The service is good and ambience is good for a date or group outing.","2","['service', 'ambience']","['positive', 'positive']"
"A great way to make some money is to buy a case of snapple from Costco and sell it right outside for only $2.50.","1","['case of snapple']","['neutral']"
"It's all about the food !!","1","['food']","['positive']"
"Fast service.","1","['service']","['positive']"
"The staff is excellent, specjal: that girl behind the bar, european chic.","2","['staff', 'bar']","['positive', 'neutral']"
"stick with the chicken, beef, and lamb dishes.","3","['chicken', 'beef', 'lamb dishes']","['positive', 'positive', 'positive']"
"The service was bad, the food took to forever to come, we sat on the upper level.","2","['service', 'food']","['negative', 'negative']"
"We a menu that rearely changes,e xcept for one or two specials, the quality and care they put in thier food in evident.","4","['specials', 'quality', 'care', 'food']","['neutral', 'positive', 'positive', 'positive']"
"This restaurant is a wonderful place to go many times and it is reasonably priced.","1","['priced']","['positive']"
"Bottom line: B+ for the food, F for the service.","2","['food', 'service']","['positive', 'negative']"
"The only thing the waiters don't do for you is wipe your chin when you leave.","1","['waiters']","['positive']"
"Stick to dimsum, not super overpriced noodles.","2","['dimsum', 'noodles']","['positive', 'neutral']"
"The service is fine and they allow you to enjoy the view.","2","['service', 'view']","['positive', 'positive']"
"We, there were four of us, arrived at noon - the place was empty - and the staff acted like we were imposing on them and they were very rude.","1","['staff']","['negative']"
"delicious simple food in nice outdoor atmosphere.","2","['food', 'atmosphere']","['positive', 'positive']"
"The only fallback on this restaurant is the prices.","1","['prices']","['negative']"
"I've been to Naples 45 for dinner twice.","1","['dinner']","['neutral']"
"The hot and sour soup was unbearably hot and tasted of only pepper and nothing else.","2","['soup', 'pepper']","['negative', 'negative']"
"Try sushimi cucumber roll.","1","['sushimi cucumber roll']","['positive']"
"The food is delicious.","1","['food']","['positive']"
"Their wines by the glass are a great accompaniment and you can eat like a king with wine for under $30.","2","['wines by the glass', 'wine']","['positive', 'neutral']"
"This place has the the correct ambience and an excellent staff to make you feel like a guest and a friend at the same time.","3","['place', 'ambience', 'staff']","['positive', 'positive', 'positive']"
"Yeah Shanghai is also great but not quite as good -- they use the same amount of salt but without sweetness to balance out.","1","['salt']","['negative']"
"believe us, we've been eating sushi for over 15 yrs.","1","['sushi']","['neutral']"
"The atmosphere is much better than Sripraphai (more modern and sleek).","1","['atmosphere']","['positive']"
"The food is outstanding and the service is quick, friendly and very professional.","2","['food', 'service']","['positive', 'positive']"
"The bagels always warm, soft on the inside, crispy on the outside and enormous in size.","1","['bagels']","['positive']"
"I had a late dinner at Lucky Stike, a great name for a joint if ever I saw one.","1","['dinner']","['neutral']"
"Service is fast and friendly.","1","['Service']","['positive']"
"from an English speaking staff.","1","['staff']","['neutral']"
"And they have these home made potato chips at the bar that are the most delicious things in the world!","2","['potato chips', 'bar']","['positive', 'neutral']"
"My husband and I enjoyed each of the 6 taste size portions and left completely full.","1","['portions']","['positive']"
"I went here with a friend on a whim, we went someplace else first and couldn't get a table.","1","['table']","['negative']"
"We all ate pasta entre'es, which were great.","1","[""pasta entre'es""]","['positive']"
"The steak was excellent and one of the best I have had (I tasted the butter intitally but in no way did it overwhelm the flavor of the meat).","4","['steak', 'butter', 'flavor', 'meat']","['positive', 'negative', 'neutral', 'positive']"
"The food was boring and expensive.","1","['food']","['negative']"
"The ambience is pretty and nice for conversation, so a casual lunch here would probably be best.","2","['ambience', 'lunch']","['positive', 'positive']"
"Terrific menu full of unique rolls and special dishes.","3","['menu', 'rolls', 'dishes']","['positive', 'positive', 'positive']"
"The service is ok but could be better.","1","['service']","['negative']"
"We love the food, drinks, and atmosphere!","3","['food', 'drinks', 'atmosphere']","['positive', 'positive', 'positive']"
"I was here a few weeks back and we had the worst customer service experience at a restaurant ever.","1","['customer service']","['negative']"
"Went on a 3 day oyster binge, with Fish bringing up the closing, and I am so glad this was the place it O trip ended, because it was so great!","3","['oyster', 'Fish', 'place']","['neutral', 'neutral', 'positive']"
"Took my mom for Mother's Day, and the maitre d' was pretty rude.","1","[""maitre d'""]","['negative']"
"My husband and I have been there a couple of times and each time we sat at the sushi bar (chef Yoshi) and ordered everything ala carte.","3","['sushi bar', 'chef', 'ala carte']","['neutral', 'neutral', 'neutral']"
"The vibe is very relaxed and cozy, service was great and the food was excellent!","3","['vibe', 'service', 'food']","['positive', 'positive', 'positive']"
"If the weather is nice, try to snag an outside table.","1","['table']","['positive']"
"If you are looking for a good quality, cheap eats - this is the place.","1","['quality']","['positive']"
"The service was friendly and the atmosphere was casual.","2","['service', 'atmosphere']","['positive', 'positive']"
"When I lived upstate for a while I would buy freeze the bagels and they would still be better than any else.","1","['bagels']","['neutral']"
"I recommend their Pad See Ew, Pork Chops or Tofu plates.","3","['Pad See Ew', 'Pork Chops', 'Tofu plates']","['positive', 'positive', 'positive']"
"Never in my life did I think that I could be satisfied both in taste and in quantity for $3.00 in NYC.","2","['taste', 'quantity']","['positive', 'positive']"
"this is the best secret place in midtown', I heard that from the bartender, after having brilliant food ( try steak with portobello mushrooms) and drinks on the bar last Tuesday.","5","['bartender', 'food', 'steak with portobello mushrooms', 'drinks', 'bar']","['neutral', 'positive', 'positive', 'positive', 'neutral']"
"The service was excellent - friendly and attentive.","1","['service']","['positive']"
"The main course had an average portion, and was decent overall.","2","['main course', 'portion']","['positive', 'neutral']"
"20 minutes for our reservation but it gave us time to have a few cocktails and enjoy our surroundings and each other.","3","['reservation', 'cocktails', 'surroundings']","['negative', 'positive', 'positive']"
"Waitstaff is great, very attentive.","1","['Waitstaff']","['positive']"
"The dinner menu is diverse and top-notch as well.","1","['dinner menu']","['positive']"
"IT IS WHAT MODERN CUISINE IS ALL ABOUT.","1","['CUISINE']","['positive']"
"I don't like Indian food too much and this was delicious, however you want to factor that into the equation.","1","['Indian food']","['positive']"
"at taj, vegetarians can rejoice-all the dishes are manna from heaven.","1","['dishes']","['positive']"
"I won't go back unless someone else is footing the bill.","1","['bill']","['negative']"
"We live in New Jersey and whenever we go into New York City we buy bagels to eat hot and then to freeze (they told me that if I call in the order, they'd bring it out to the car so I wouldn't have to look for parking).","1","['bagels']","['neutral']"
"Jimmy's is hands down the hottest night spot in the Bronx.","1","['spot']","['positive']"
"And I would have to agree with the masses in terms of service - delivery is their Achilles' heel.","2","['service', 'delivery']","['negative', 'negative']"
"The $300 bill was a bit steep, but the experience was great.","1","['bill']","['negative']"
"Nice ambiance, nice little bar, good bartender, Francois, and good service.","4","['ambiance', 'bar', 'bartender', 'service']","['positive', 'positive', 'positive', 'positive']"
"The calamari comes with an incredible sauce, and the duck noodles are yummy as well.","3","['calamari', 'sauce', 'duck noodles']","['positive', 'positive', 'positive']"
"I would definitely go back -- if only for some of those exotic martinis on the blackboard.","1","['martinis']","['positive']"
"Simple comfort food and what hot and lage portions.","2","['comfort food', 'portions']","['positive', 'positive']"
"Stay away from the two specialty rolls on the menu, though- too much avocado and rice will fill you up right quick.","4","['rolls', 'menu', 'avocado', 'rice']","['negative', 'neutral', 'negative', 'negative']"
"We didn't get drink refills and she didn't even offer us the option of dessert.","2","['drink refills', 'dessert']","['negative', 'neutral']"
"The bagels are also reasonably priced for NYC.","2","['bagels', 'priced']","['positive', 'positive']"
"If you can handle that, it's a great place for a business dinner, fun with friends or simply a table for 2.","2","['business dinner', 'table']","['positive', 'positive']"
"Decor leaves something to be desired.","1","['Decor']","['negative']"
"Also, specify if you like your food spicy- its rather bland if you don't.","1","['food']","['neutral']"
"Our waiter was fine, the place looks nice in that not-trying-too-hard way, but at those prices, a little more should be expected of your food.","4","['waiter', 'place', 'prices', 'food']","['positive', 'positive', 'negative', 'negative']"
"Coming from Boston this place is like Emma's Pizza in Kendall Square in Cambridge (although they have more funky toppings!)","1","['toppings']","['positive']"
"When my husband and go there, we spend $60.00 (have LOBSTER TAILS UMMMMM need I say more) I can't say any more, it a place you'll never forget If you never go, you'll miss A Meal of your life time","3","['LOBSTER TAILS', 'place', 'Meal']","['positive', 'positive', 'positive']"
"in an effort to increase turnover, the restaurant offers no desserts beyond the complimentary espresso cup filled with chocolate mousse.","2","['desserts', 'espresso cup filled with chocolate mousse']","['negative', 'positive']"
"I've been to this restaurant more than a dozen times and when I'm craving for Pho, Lemon grass chicken or Beef Cube on rice, this is the place to go.","3","['Pho', 'Lemon grass chicken', 'Beef Cube on rice']","['positive', 'positive', 'positive']"
"Oh yes, and if you are a fan of Indian oldies film stars, there are plenty of portraits of Indian actors and actresses in classic black white that adorn the walls, some of which, I would love to know where they obtained.","1","['portraits']","['positive']"
"The food is spectacular, from the appitizers to the main course, and then of course the desserts, (WOW) you'll need no more.","4","['food', 'appitizers', 'main course', 'desserts']","['positive', 'positive', 'positive', 'positive']"
"My fish was delicious in an incredible curry sauce.","2","['fish', 'curry sauce']","['positive', 'positive']"
"If you are in search of the most authentic NYC deli experience look no further than the famous and historic Katz's Deli down on the Lower East Side.","1","['deli']","['positive']"
"Even upon delivery, their juicy pork buns are quite good . .","1","['pork buns']","['positive']"
"Average to good Thai food, but terrible delivery.","2","['Thai food', 'delivery']","['positive', 'negative']"
"The space is nice but when we order our drink we were in for a surprise.","2","['space', 'drink']","['positive', 'negative']"
"The entire place and the treatment we received felt as a conveyor belt.","1","['place']","['negative']"
"Joe's Pizza used to have the best slice until this pizzeria opened up.","1","['slice']","['positive']"
"And they provided a delicious dessert on the house!","1","['dessert']","['positive']"
"They are still living in the dark ages and do not have an answering machine, so if you want to make a reservation you are limited.","1","['reservation']","['negative']"
"The food is amazing, rich pastas and fresh doughy pizza.","3","['food', 'pastas', 'pizza']","['positive', 'positive', 'positive']"
"Food was very good, but not what I would consider out of this world.","1","['Food']","['positive']"
"I had Lobster Bisque it has 2 oz. of Maine Lobster in it.","2","['Lobster Bisque', 'Maine Lobster']","['positive', 'positive']"
"Try the Pad Thai, it's fabulous and their prices are so cheap!","2","['Pad Thai', 'prices']","['positive', 'positive']"
"Food is great and inexpensive.","1","['Food']","['positive']"
"The price very reasonable.","1","['price']","['positive']"
"Dessert - can't be missed, so save room!!!","1","['Dessert']","['positive']"
"It can be a little confusing as to where one goes to order, but once the food is ordered, you are in for a treat.","1","['food']","['positive']"
"Ingredients are organic which is a real plus for me.","1","['Ingredients']","['positive']"
"It was so bad I actually refused to pay for my food.","1","['food']","['negative']"
"I recommend this spot to anyone who enjoys  fine cuisine at reasonable prices.","2","['cuisine', 'prices']","['positive', 'positive']"
"The staff was very attentive, the ambience lovely, and the food superb.","3","['staff', 'ambience', 'food']","['positive', 'positive', 'positive']"
"I love when restaurants think using fancy expensive ingrediants makes the food fine cuisine, even with no idea how to use them.","3","['ingrediants', 'food', 'cuisine']","['positive', 'positive', 'positive']"
"THe Pizza and wine were excellent-the service too--but what really MADE this place was the backyard dining area.","4","['Pizza', 'wine', 'service', 'backyard dining area']","['positive', 'positive', 'positive', 'positive']"
"The waiters are sweet, the food is tasty and the bill is never too large.","3","['waiters', 'food', 'bill']","['positive', 'positive', 'positive']"
"The service was superb, they treat you like family.","1","['service']","['positive']"
"We all had the tasting menu and unlike some of the other reviews, I felt there was more than enough food.","2","['menu', 'food']","['positive', 'positive']"
"It only took about five or so minutes to get an empty table, but standing up wasn't too bad.","1","['table']","['positive']"
"The menu may be small, but everything on it is delicious.","1","['menu']","['negative']"
"They had scrapped the bottom of the vessel in which they make the rice -RESULT - WE HAD LARGE CHUNKS OF BURNT RICE IN OUR SERVING BOWL.","2","['rice', 'RICE']","['negative', 'negative']"
"Warm, comfortable surroundings, nice appointments (witness the etched glass and brickwork separating the dining rooms).","2","['surroundings', 'dining rooms']","['positive', 'neutral']"
"We ran a little late for the reservation but it wasn't a problem to get our table immediately.","2","['reservation', 'table']","['neutral', 'positive']"
"We arrived on time for our reservation and seated promptly.The","1","['reservation']","['positive']"
"I would definitely go back for a very special occasion, but not for regular fine dining.","1","['dining']","['neutral']"
"The well mannered, pleasant staff that Tony has in his employ.","1","['staff']","['positive']"
"The flavors robust and subtle.","1","['flavors']","['positive']"
"All I can say is $2 pints during happy hour and the some of the cheapest oysters you'll find in the city, though the quality is some of the best.","2","['oysters', 'quality']","['positive', 'positive']"
"I would never wait for a table to eat, it just is not THAT great.","1","['table']","['neutral']"
"We concluded with tiramisu chocolate cake, both were delicious.","1","['tiramisu chocolate cake']","['positive']"
"The counter service is bad.","1","['counter service']","['negative']"
"Service here was great, food was fantastic.","2","['Service', 'food']","['positive', 'positive']"
