"This is a great Thai restaurant with a very friendly staff.","1","['staff']","['positive']"
"I ordered the smoked salmon and roe appetizer and it was off flavor.","1","['smoked salmon and roe appetizer']","['negative']"
"We went here for lunch a couple of weeks ago on a Saturday, and I was thoroughly impressed with the food.","2","['lunch', 'food']","['neutral', 'positive']"
"I recommend the garlic shrimp, okra (bindi), and anything with lamb.","3","['garlic shrimp', 'okra (bindi)', 'lamb']","['positive', 'positive', 'positive']"
"As we were leaving, the couple standing by the door said to another waiter, we're not in a hurry.","1","['waiter']","['neutral']"
"The menu was impressive with selections ranging from a burger, to steak, to escargot.","4","['menu', 'burger', 'steak', 'escargot']","['positive', 'neutral', 'neutral', 'neutral']"
"In fact, two people could really share one plate.","1","['plate']","['positive']"
"The food is great and authentic.","1","['food']","['positive']"
"Good for casual dinner with jeans and sneakers.","1","['casual dinner']","['positive']"
"Anyway, the food is good, the price is right and they have a decent wine list.","3","['food', 'price', 'wine list']","['positive', 'positive', 'positive']"
"Prices are higher to dine in and their chicken tikka marsala is quite good.","2","['Prices', 'chicken tikka marsala']","['negative', 'positive']"
"This place has many different styles of pizza and they are all amazing.","1","['styles of pizza']","['positive']"
"The photos of the restaurant in its web site are way better than the real look.","1","['look']","['negative']"
"The food was lousy - too sweet or too salty and the portions tiny.","2","['food', 'portions']","['negative', 'negative']"
"But the coconut rice was good.","1","['coconut rice']","['positive']"
"It took them 25 minutes to bring our appetizer.","1","['appetizer']","['neutral']"
"The food was great.","1","['food']","['positive']"
"Pair you food with the excellent beers on tap or their well priced wine list.","4","['food', 'beers on tap', 'priced', 'wine list']","['neutral', 'positive', 'positive', 'positive']"
"If you like your music blasted and the system isnt that great and if you want to pay at least 100 dollar bottle minimun then you'll love it here.","2","['music', 'bottle minimun']","['negative', 'negative']"
"All of my co-workers stated that the food was amazing and wondered why they hadn't heard about this place.","1","['food']","['positive']"
"Metrazur has a beautiful spot overlooking the main terminal.","1","['spot']","['positive']"
"Friendly staff that actually lets you enjoy your meal and the company you're with.","2","['staff', 'meal']","['positive', 'positive']"
"The restaurant is rather small but we were lucky to get a table quickly.","1","['table']","['positive']"
"Quality of food is excellent and price is cheap, stick to pork, fish, chicken, lamb and vegetables.","7","['Quality of food', 'price', 'pork', 'fish', 'chicken', 'lamb', 'vegetables']","['positive', 'positive', 'positive', 'positive', 'positive', 'positive', 'positive']"
"The place is a little tight and on a cold day, the seating by the entranceway can be pretty drafty.","2","['place', 'seating']","['negative', 'negative']"
"The appetizing is excellent - just as good as Zabars Barney Greengrass at a reasonable price (if bought by the pound).","2","['appetizing', 'price']","['positive', 'positive']"
"But, they were too big for the bun.","1","['bun']","['neutral']"
"The food is fresh, delicious, and reasonably priced.","2","['food', 'priced']","['positive', 'positive']"
"Raga stands out with an interesting fusion of French and Indian cooking.","1","['fusion of French and Indian cooking']","['positive']"
"A few tips: skip the turnip cake, roast pork buns and egg custards.","3","['turnip cake', 'roast pork buns', 'egg custards']","['negative', 'negative', 'negative']"
"The bagels are fabulous.","1","['bagels']","['positive']"
"Oh yes, and they lie on the phone, claiming they have seating in the garden, then of course the seats are not available.","2","['seating in the garden', 'seats']","['neutral', 'neutral']"
"Although they do the typical what kind of water would you like questions the service was good and overall very relaxing to place to eat.","3","['water', 'service', 'place']","['neutral', 'positive', 'positive']"
"The food was very good, a great deal, and the place its self was great.","2","['food', 'place']","['positive', 'positive']"
"The food options rule.","1","['food options']","['positive']"
"A great choice at any cost and a great deal.","1","['cost']","['positive']"
"We ate here in March, 2006 and ordered the pre-theatre 3-course dinner with wine flight.","2","['pre-theatre 3-course dinner', 'wine flight']","['neutral', 'neutral']"
"Probably much busier for lunch, it's seldom crowded for dinner (too close to downtown).","2","['lunch', 'dinner']","['neutral', 'neutral']"
"Their calzones are horrific, bad, vomit-inducing, YUCK.","1","['calzones']","['negative']"
"It takes forever to get a drink and they almost always forget to bring something (although they dont forget to charge you for it.","1","['drink']","['neutral']"
"The place itself is beautiful the bar scene seems to be happening.","2","['place', 'bar scene']","['positive', 'positive']"
"Saturday, Nov. 6th I had a group from work come in with about 35 people and the staff was amazing to accomodate us.","1","['staff']","['positive']"
"Good spreads, great beverage selections and bagels really tasty.","3","['spreads', 'beverage selections', 'bagels']","['positive', 'positive', 'positive']"
"First, the waiter who served us neglected to fill us in on the specials, which I would have chosen had I known about them.","3","['waiter', 'served', 'specials']","['negative', 'negative', 'positive']"
"Also, top the meal with a delicious and perfect slice of tiramisu.","2","['meal', 'tiramisu']","['neutral', 'positive']"
"Check out the secret back room.","1","['secret back room']","['positive']"
"It's also attached to Angel's Share, which is a cool, more romantic bar...","1","['bar']","['positive']"
"Authentic food and they have REAL service, not just the rush you get sometimes when they try to push you out the door.","2","['food', 'service']","['positive', 'positive']"
"Stick to the gulab jamun.","1","['gulab jamun']","['positive']"
"I am amazed by the poor reviews- I find this place to be standout Italian in an area flooded with Italian- great prices, great atmosphere, good service and a wonderful wine list.","4","['prices', 'atmosphere', 'service', 'wine list']","['positive', 'positive', 'positive', 'positive']"
"I was back-to-back with the diner at the table behind me and wait staff had to hoist trays over our heads as they squeezed past us again and again.","3","['diner', 'table', 'wait staff']","['neutral', 'negative', 'negative']"
"With the theater 2 blocks away we had a delicious meal in a beautiful room.","2","['meal', 'room']","['positive', 'positive']"
"We've only eaten in the restaurant once, but we have ordered many times for dinner.","1","['dinner']","['neutral']"
"By far this is the only chinese desserts place I know in NY or anywhere close in the Northeastern America that serves desserts with frog jelly in a couple of varieties and pig feet ginger simmered in black vinegar.","2","['desserts with frog jelly', 'pig feet ginger simmered in black vinegar']","['positive', 'positive']"
"The food is great and reasonably priced.","2","['food', 'priced']","['positive', 'positive']"
"I would definitely recommend SEA if you like thai cuisine!","1","['thai cuisine']","['positive']"
"Over the years the host, Vittorio, and his crew, have always treated me as family--although with all the business this not-so-little gem does, it amazing he's even able to remember a consistent but not-so-frequent visitor.","2","['host', 'crew']","['positive', 'positive']"
"The restuarant itself is not large, but seems to have several round tables to accomodate large groups hoping to save a buck to eat authentic Taiwanese.","2","['round tables', 'Taiwanese']","['positive', 'positive']"
"My husband said he could've eaten several more, the portion was fine for me he even exclaimed that the french fries were the best he has had.","1","['french fries']","['positive']"
"It is the type of place to run into old friends and have a late, raucus dinner.","1","['dinner']","['positive']"
"The food is delicious - from the specials to the regular menu-fare, the dishes are never a disappointment.","4","['food', 'specials', 'regular menu-fare', 'dishes']","['positive', 'positive', 'positive', 'positive']"
"Prices are in line.","1","['Prices']","['neutral']"
"The combination of fresh tomato sauce, fresh mozz cheese, basil and the dough they make with imported flour, makes this is one of the better pizza's in NY.","6","['fresh tomato sauce', 'fresh mozz cheese', 'basil', 'dough', 'flour', 'pizza']","['positive', 'positive', 'positive', 'positive', 'positive', 'positive']"
"The food is prepared quickly and efficiently.","1","['food']","['positive']"
"For all of you new to Indian food, try the Paneer Roll, it is a piece of heaven.","2","['Indian food', 'Paneer Roll']","['positive', 'positive']"
"The food looked very appetizing and delicious since it came on a variety of fancy plates.","2","['food', 'plates']","['positive', 'positive']"
"Both the fresh mozzerella slices and the Plain Cheese slice are phenomenal.","2","['fresh mozzerella slices', 'Plain Cheese slice']","['positive', 'positive']"
"The food is terrible and overall, I would have to say avoid at all costs.","1","['food']","['negative']"
"Unfortunately, the food was NOT something to get worked up about.","1","['food']","['negative']"
"It's constantly open, catering to the Pakistani cabbies lined up on Crosby St., so there's more turnover with the food than you'd expect (i.e., surprisingly fresh).","1","['food']","['positive']"
"I had Filet Mignon with garlic mash.","1","['Filet Mignon with garlic mash']","['neutral']"
"I went at 6:00 PM specifically for the pre-theater menu ($19.95 for roasted tomato soup with chevre, steak frites, creme brulee) and it was marvelous.","4","['pre-theater menu', 'roasted tomato soup with chevre', 'steak frites', 'creme brulee']","['positive', 'positive', 'positive', 'positive']"
"The waitstaff were attentive, polite and helpful - an impressive feat in such close quarters.","1","['waitstaff']","['positive']"
"- the bread at the beginning is super tasty and makes you want more - the pizza is delicious and comes in personal sizes, however be warned that the Peter's Favourite pizza with prosciutto and baby arugula is actually a margarite pizza with cold prosciutto and baby arugula on top, like a salad.","5","['bread', 'pizza', ""Peter's Favourite pizza with prosciutto and baby arugula"", 'margarite pizza with cold prosciutto and baby arugula on top', 'salad']","['positive', 'positive', 'neutral', 'neutral', 'neutral']"
"The large selection of bruschettas, paninis, tramezzinis keep the palate from stagnating.","3","['bruschettas', 'paninis', 'tramezzinis']","['positive', 'positive', 'positive']"
"Have always found that the waiters will go out of their way to be helpful, despite the fact they are often busy with lots of diners.","2","['waiters', 'diners']","['positive', 'neutral']"
"While this isn't classical restaurant fare, the chef has given new life to an old cuisine with some really innovative and tasty dishes that are genuinely Indian without being heavy or same old restaurant burn-outs.","4","['chef', 'cuisine', 'dishes', 'Indian']","['positive', 'neutral', 'positive', 'positive']"
"The owner truly caters to all your needs.","1","['owner']","['positive']"
"He takes real pride in his food and his business.","1","['food']","['positive']"
"So if you want a nice, enjoyable meal at Montparnasse, go early for the pre-theater prix-fixe.","2","['meal', 'pre-theater prix-fixe']","['positive', 'positive']"
"Over the years, it has always provided a pleasurable dining experience with quality food and wine.","3","['dining', 'food', 'wine']","['positive', 'positive', 'positive']"
"The photobook menu was a cute touch, certainly helped my group and I pick the fried chicken, pork chop, and noodle dishes that we all ordered.","4","['menu', 'fried chicken', 'pork chop', 'noodle dishes']","['positive', 'neutral', 'neutral', 'neutral']"
"I cannot imagine better Indian food in all of the city.","1","['Indian food']","['positive']"
"Great romantic place for a date (try to get the corner booth table for a little privacy and to sit close!).","3","['place', 'corner booth table', 'privacy']","['positive', 'positive', 'positive']"
"I asked for an open faced cheese sandwich and the manager basically told me to take my business elsewhere!","2","['open faced cheese sandwich', 'manager']","['neutral', 'negative']"
"very good breads as well.","1","['breads']","['positive']"
"if this happens, just ask for real naan.","1","['naan']","['neutral']"
"We were fans of the half-price Saturday night option until some inedible squid during a recent visit.","2","['half-price Saturday night option', 'squid']","['positive', 'negative']"
"Pizza is terrific, as is homemade pasta.","2","['Pizza', 'homemade pasta']","['positive', 'positive']"
"This is a wonderful place on all stand points especially value ofr money.","1","['value ofr money']","['positive']"
"Example is the soup which was about 6 oz for $12 dollars and the mushrooms where $12 for about 1oz.","2","['soup', 'mushrooms']","['positive', 'positive']"
"There are other people waiting!","1","['waiting']","['negative']"
"From beginning appetizers, the scallops were incredible, to the delicious chocolate souffle with rasberry mint sorbet, we were delighted by the taste sensations.","4","['beginning appetizers', 'scallops', 'chocolate souffle with rasberry mint sorbet', 'taste']","['positive', 'positive', 'positive', 'positive']"
"Consistently good Japanese Tapas.","1","['Japanese Tapas']","['positive']"
"My goodness, everything from the fish to the rice to the seaweed was absolutely amazing.","3","['fish', 'rice', 'seaweed']","['positive', 'positive', 'positive']"
"The dishes offered were unique, very tasty and fresh from the lamb sausages, sardines with biscuits, large whole shrimp to the amazing pistachio ice cream (the best and freshest I've ever had).","5","['dishes', 'lamb sausages', 'sardines with biscuits', 'large whole shrimp', 'pistachio ice cream']","['positive', 'positive', 'positive', 'positive', 'positive']"
"The food is reliable and the price is moderate.","2","['food', 'price']","['positive', 'neutral']"
"While the ambiance and atmosphere were great, the food and service could have been a lot better.","4","['ambiance', 'atmosphere', 'food', 'service']","['positive', 'positive', 'negative', 'negative']"
"The server was really cool and served us our food and drinks with a smile.","4","['server', 'served', 'food', 'drinks']","['positive', 'positive', 'neutral', 'neutral']"
"We were in search of food and stumbled on this block of Indian restaurants on East Sixth Street.","1","['food']","['neutral']"
"Planet Thailand has always been a hit with me , I go there usually for the sushi, which is great , the thai food is excellent too .","2","['sushi', 'thai food']","['positive', 'positive']"
"Very excited to hear that short-term Chef Jason Narone has moved on, he truly was a low point of their Sterling track record.","1","['Chef']","['negative']"
"I had to share my table with a loud group of kids and the service was rude an unattentive.","2","['table', 'service']","['negative', 'negative']"
"The sauce on the pizza is sooo good with garlic and fresh tomatoes and they don't skimp.","3","['sauce on the pizza', 'garlic', 'fresh tomatoes']","['positive', 'positive', 'positive']"
"We recently decided to try this location, and to our delight, they have outdoor seating, perfect since I had my yorkie with me.","1","['outdoor seating']","['positive']"
"My husband had the mesclun, salmon, and ice cream and he enjoyed all 3 courses.","4","['mesclun', 'salmon', 'ice cream', 'courses']","['positive', 'positive', 'positive', 'positive']"
"We were told that the wait was about twenty minutes and there would be no problem for our 8:00 pm curtain call.","1","['wait']","['neutral']"
"The food is usually good but it certainly isn't a relaxing place to go.","2","['food', 'place']","['positive', 'negative']"
"Super friendly and knowledgable staff, fabulous bistro fare and a wonderful jazz brunch with great live jazz (the chilaquiles were awesome!","5","['staff', 'bistro fare', 'jazz brunch', 'live jazz', 'chilaquiles']","['positive', 'positive', 'positive', 'positive', 'positive']"
"The prices were fantastic.","1","['prices']","['positive']"
"Still, any quibbles about the bill were off-set by the pour-your-own measures of liquers which were courtesey of the house...","1","['measures of liquers']","['positive']"
"The table service could have been a little more attentive but as someone who also works in the service industry, I understood they were busy.","1","['service']","['neutral']"
"It's not mind-blowing, but to me, thai food never is and never will be.","1","['thai food']","['neutral']"
"Food was very good as well, considering that we tried the budget selection (though I wish the pork belly that I ordered was roasted a bit longer, so that fat was more of a melt-in-your-mouth experience).","3","['Food', 'pork belly', 'fat']","['positive', 'negative', 'negative']"
"i've been to sapphire twice and both times the food was fine, if not good.","1","['food']","['positive']"
"It is kinda nosiy and the tables are close together but it's still a beautiful place to enjoy a nice dinner.","3","['tables', 'place', 'dinner']","['negative', 'positive', 'positive']"
"I love the fact that the pizza tastes so good and is so cheap.","1","['pizza']","['positive']"
"Nicky the Nose at the bar is a treat.","1","['bar']","['neutral']"
"Service was prompt, friendly and great.","1","['Service']","['positive']"
"I haven't eat a lamb chop as delicious as that,the salads are really nice dressed with lemon and extra virgnin olive oil.","4","['lamb chop', 'salads', 'lemon', 'extra virgnin olive oil']","['positive', 'positive', 'positive', 'positive']"
"The sushi was awful!","1","['sushi']","['negative']"
"You can get an excellent meal at most of the many Indian restaurants on nearby Lexington Avenue for the cost of one the dainty dishes here.","2","['meal', 'dishes']","['positive', 'positive']"
"The Pastrami sandwich was like buttah and with pickles and an icy cold beer to wash it down, it was a pleasurable experience.","3","['Pastrami sandwich', 'pickles', 'beer']","['positive', 'positive', 'positive']"
"The plain pizza was soggy and the creative wild mushroom(third generation-Fornini) pizza we had was drenched with truffle oil in the middle( again making it soggy) and nothingon the rest.","3","['plain pizza', 'wild mushroom(third generation-Fornini) pizza', 'truffle oil']","['negative', 'positive', 'neutral']"
"Late nite omelletes are not good here, there is no variety!","1","['omelletes']","['negative']"
"After all that, they complained to me about the small tip.","1","['tip']","['negative']"
"It's a great place to pick up a cheap lunch or dinner.","2","['lunch', 'dinner']","['positive', 'positive']"
"Behind this counter, two men are squeezed in.","1","['counter']","['negative']"
"Whenever you need a Sushi fix, Mizu will be there with quality fish and great service.","3","['Sushi fix', 'fish', 'service']","['positive', 'positive', 'positive']"
"Our waitress was sweet and accomodating, not overbearing.","1","['waitress']","['positive']"
"Went there with my wife and we had to wait for a table even though you could see there many that were empty with not reservation sigh on them.","2","['table', 'reservation sigh']","['negative', 'neutral']"
"I was really disappointed ant wanted to tell everyone not to go eat or even take out food from there.","1","['food']","['negative']"
"Despite a slightly limited menu, everything prepared is done to perfection, ultra fresh and a work of food art.","2","['menu', 'food art']","['negative', 'positive']"
"The outdoor atmosphere of sitting on the sidewalk watching the world go by 50 feet away on 6th avenue on a cool evening was wonderful.","1","['outdoor atmosphere']","['positive']"
"A large is $20, and toppings are about $3 each.","1","['toppings']","['neutral']"
"brick oven gallery is My pick for best pizza restaurant anywhere.","1","['pizza']","['positive']"
"Add to that great service and great food at a reasonable price and you have yourself the beginning of a great evening.","3","['service', 'food', 'price']","['positive', 'positive', 'positive']"
"For many people, this may not seem like Aunthentic Thai food because most places in NYC arent quite authentic.","1","['Thai food']","['negative']"
"Growing up in NY, I have eaten my share of bagels.","1","['bagels']","['neutral']"
"Oh, don't even let me start with how expensive the bills were!","1","['bills']","['negative']"
"The scallion pancakes and fried dumplings were nothing out of the ordinary.","2","['scallion pancakes', 'fried dumplings']","['neutral', 'neutral']"
"All the appetizers and salads were fabulous, the steak was mouth watering and the pasta was delicious!!!","4","['appetizers', 'salads', 'steak', 'pasta']","['positive', 'positive', 'positive', 'positive']"
"Besides having the table we had been promised given to other restaurant patrons twice before we were actually seated, we were served dishes we hadn't ordered three times, received one of our orders 20 minutes after the rest of the table had been served (and that order was undercooked), and charged $45 more than we should have been on our bill.","6","['table', 'served', 'dishes', 'table', 'served', 'bill']","['negative', 'negative', 'negative', 'negative', 'negative', 'negative']"
"Service is top notch.","1","['Service']","['positive']"
"The food now is inconsistent.","1","['food']","['negative']"
"You can also special order any kind of dumpling,etc.","1","['dumpling']","['positive']"
"I was pretty much full after our fondue appetizer.","1","['fondue appetizer']","['neutral']"
"BE CAREFUL before you request extra spice.","1","['spice']","['neutral']"
"The octopus eaters were floored by the Octopus salad.","1","['Octopus salad']","['positive']"
"We thought that this place is using too much of MSG cooking in the foods.","2","['MSG cooking', 'foods']","['negative', 'negative']"
"And the Tom Kha soup was pathetic.","1","['Tom Kha soup']","['negative']"
"I started out with a Bombay beer which was big enough for two.","1","['Bombay beer']","['positive']"
"The decor is vibrant and eye-pleasing with several semi-private boths on the right side of the dining hall, which are great for a date.","3","['decor', 'semi-private boths', 'dining hall']","['positive', 'positive', 'positive']"
"Service was quick.","1","['Service']","['positive']"
"Drawbacks: service is slow and they don't toast!","1","['service']","['negative']"
"Went there for an office lunch.","1","['office lunch']","['neutral']"
"The sweet lassi was excellent as was the lamb chettinad and the garlic naan but the rasamalai was forgettable.","4","['sweet lassi', 'lamb chettinad', 'garlic naan', 'rasamalai']","['positive', 'positive', 'positive', 'negative']"
"We've been following chef Lyle's food around New York for 15 years and while remaining classic, his innovations with bistro fare have made us return and return.","3","['chef', 'food', 'bistro fare']","['positive', 'positive', 'positive']"
"The best thing I tasted were the lambchops.","1","['lambchops']","['positive']"
"The spicy tuna and salmon are the best we've ever had.","2","['spicy tuna', 'salmon']","['positive', 'positive']"
"Even though its good seafood, the prices are too high.","2","['seafood', 'prices']","['positive', 'negative']"
"In addition, the food is very good and the prices are reasonable.","2","['food', 'prices']","['positive', 'positive']"
"Upon entering, we were greeted by the owners, Steven and Frederick, who went out of their way to be more than gracious hosts.","2","['owners', 'hosts']","['positive', 'positive']"
"Been going here since it opened have seen the quality value decrease considerably.","1","['quality value']","['negative']"
"Meat dishes now adorn the selections, although there's still a large number of vegetarian-friendly choices.","2","['Meat dishes', 'vegetarian-friendly choices']","['neutral', 'positive']"
"Reasonable prices.","1","['prices']","['positive']"
"they bring service up a notch by offerng complementary amuse bouche to all tables and gave us a small dessert for our celebration.","4","['service', 'amuse bouche', 'tables', 'dessert']","['positive', 'positive', 'positive', 'positive']"
"Try the crunchy tuna, it is to die for.","1","['crunchy tuna']","['positive']"
"It won't break the bank but I also wouldnt come back for the food.","1","['food']","['negative']"
"All in all, this midtown gem instantly became one of my favorite sushi restaurants in the city.","1","['sushi']","['positive']"
"It is a lot of fun with live entertainment and all kinds of Disney type special effects.","2","['live entertainment', 'special effects']","['positive', 'positive']"
"if you're looking for perfect traditional sushi, go here - if you're looking for interesting combinations, try sushi of gari's (east side).","2","['sushi', 'sushi']","['positive', 'positive']"
"No refills on fountain drinks, though.","1","['fountain drinks']","['negative']"
"Wow over 100 beers to choose from.","1","['beers']","['positive']"
"Be careful of portions - they're HUGE.","1","['portions']","['positive']"
